Question,Answer
Что такое ОДН и как производится расчёт?,"ОДН - общедомовые нужды. В каждый многоквартирный дом поступает определенное количество коммунальных ресурсов, основная доля которых потребляется жильцами. Некоторая же часть ресурсов идет на обслуживание дома и содержание общедомового имущества. Оплачиваются не только коммунальные услуги внутри квартиры, но и коммунальные услуги, идущие на общедомовые нужды.В сумму ОДН по электроэнергии могут входить затраты на:Освещение мест общего пользования (лестничных площадок, тамбуров и приподъездной территории);Энергию, потребляемую домофонами;Энергию, потребляемую лифтами;Энергию, потребляемую иным электрооборудованием; Использующимся в общедомовых нуждах (например, видеокамеры наблюдения, насосы, подкачивающие воду на верхние этажи, система автоматического регулирования тепла и др).У каждого многоквартирного дома набор электрооборудования индивидуален. Расчёт потребленной электроэнергии на ОДН производится в соответствии с Постановлением Правительства РФ № 354 от 06.05.2011 г. П.44:На основании показаний коллективных приборов учёта;Расход за ОДН определяется как разница между расходом определенным коллективным прибором учёта и суммарным расходом жилых и нежилых помещений, далее делится на суммарную площадь таких помещений, а затем умножается на индивидуальную площадь каждого из них.При отсутствии общедомового прибора учета расчёт производится по нормативу. В случае если расход электроэнергии на ОДН определяется исходя из норматива ОДН, то величина, полученная путем умножения норматива на ОДН и площади помещений, входящих в состав общего имущества в многоквартирном доме, делится на суммарную площадь помещений, а затем умножается на индивидуальную площадь каждого из них."
Почему расход электроэнергии на ОДН ежемесячно меняется и как добиться снижения суммы на ОДН?,"Величина расхода электроэнергии на ОДН является расчётной и зависит от нескольких факторов и может меняться каждый месяц.Расход на ОДН зависит от таких факторов, как:Интенсивность работы электрооборудования, установленного на ОДН;Регулярность передачи жителями дома индивидуальных показаний приборов учёта в АО «Мосэнергосбыт» (если не передаются показания, то расчёт формируется исходя из рассчитанного среднемесячного объёма потребления, а при передаче или снятии показаний в последующем расчётном периоде, будет произведен перерасчёт объёма потребления по фактическим данным);Отсутствие безучётного и/или бездоговорного потребления;Техническое состояние внутридомовой проводки (электропроводка в старых домах может быть изношена и это увеличивает технологические потери электроэнергии во внутридомовых сетях);Оснащённость жилых помещений исправными приборами учёта."
Почему объем ОДН между всеми потребителями распределяется пропорционально размеру общей площади принадлежащего им жилого и нежилого помещения?,"Расчёт производится в соответствии с правилами предоставления коммунальных услуг утвержденных Постановлением Правительства РФ №354 от 06.05.2011.Согласно Жилищному Кодексу РФ собственники квартир и нежилых помещений являются также собственника помещений, входящих в общее имущество дома, в доле, пропорциональной площади их квартир."
Влияет ли задолженность жителей на величину ОДН?,"Недоплата жителей дома не оказывает влияния на величину электропотребления на ОДН. Задолженность отдельных жителей не перекладывается на добросовестных потребителей. В расчет ОДН принимаются только начисленные суммы электропотребления, а не оплаченные."
Сроки передачи показаний жителей г. Королев,"Передавать показания прибора учёта жители г. Королев могут ежемесячно в период с 15 по 23 число включительно.В случае если показания не были переданы, в соответствии с Постановлением Правительства РФ № 354 от 06.05.2011 г. и №344 от 16.04.2013 г., счёт на оплату будет сформирован на основании среднемесячного объёма потребления"
Какие преимущества многотарифного прибора учета?,"Многотарифный прибор учёта обеспечивает дифференцированный учёт потребляемой электроэнергии в зависимости от времени суток. Сутки разделены на зоны, для каждой зоны установлен свой тариф на электроэнергию.Многотарифная система учёта предоставляет жителям возможность оплачивать потребление электроэнергии в ночные часы по тарифу, который примерно в четыре раза дешевле дневного, а в период действия тарифов «полупиковой зоны» экономия составляет примерно 25%. Дополнительной экономии можно достичь за счёт перераспределения на полупиковую и ночную тарифные зоны работы энергоёмких домашних бытовых приборов."
"Что делать, если неисправен прибор учёта?","При обнаружении неисправности прибора учёта необходимо незамедлительно сообщить об этом в АО «Мосэнергосбыт».Неисправным считается прибор, у которого:диск не вращается или вращается неравномерно (рывками),индикатор или дисплей не работают, имеются механические сквозные повреждения корпуса, просверленные отверстия, смотровое окно разбито или отклеено от корпуса, нарушена герметичность. Прибор учета считается вышедшим из строя в случаях:неотображение результатов измерений;нарушение пломб;механические повреждения;превышение допустимой погрешности;истечение сроков поверки (определяются с учетом особенностей, перечисленных в п. 136 Основных положений);наличие признаков несанкционированного вмешательства.Оформить бесплатную заявку на замену прибора учета можно:жителям многоквартирных домов по телефону АО «Мосэнергосбыт» +7 (499) 550-9-550 (ежедневно с 8:30 до 20:30) или в Едином личной кабинете;жителям частного сектора – по телефону сетевой компании ПАО «Россети Московский регион» 8-800-220-0-220."
За чей счёт производится замена прибора учёта?,"В соответствии с требованиями Федерального закона от 27.12.2018 № 522-ФЗ «О внесении изменений в отдельные законодательные акты Российской Федерации в связи с развитием систем учёта электрической энергии (мощности) в Российской Федерации» и постановления Правительстваот 29.06.2020 № 950 «О внесении изменений в некоторые акты Правительства Российской Федерации по вопросам совершенствования организации учёта электрической энергии» с 1 июля 2020 года обязанность по замене неисправных приборов учёта электроэнергии или счётчиков электроэнергии с истекшим межповерочным интервалом, в жилых помещениях многоквартирных жилых домов возложена на гарантирующего поставщика электроэнергии. В Москве и Московской области гарантирующим поставщиком электроэнергии является АО «Мосэнергосбыт». В индивидуальных жилых домах эта обязанность возложена на сетевые организации ПАО «Россети Московский регион». Если по состоянию на 01.04.2020 или ранее у потребителя отсутствовал ПУ/истек срок его эксплуатации/вышел из строя, то установка (замена) ПУ осуществляется до 31.12.2023. Если по состоянию на 01.04.2020 или ранее у потребителя истек МПИ ПУ, то установка (замена) со стороны ГП осуществляется до 31.12.2021. В иных случаях – установка (замена) должна быть осуществлена в течение 6 месяцев.График замены приборов учета в многоквартирных жилых домах Москвы и Московской области можно посмотреть на сайте АО «Мосэнергосбыт»Оформить бесплатную заявку на замену прибора учета можно:жителям многоквартирных домов по телефону АО «Мосэнергосбыт» +7 (499) 550-9-550 (ежедневно с 8:30 до 20:30) или в Едином личной кабинете;жителям частного сектора – по телефону сетевой компании ПАО «Россети Московский регион» 8-800-220-0-220.В остальных случаях замена/установка прибора учета осуществляется на платной основе за счет собственных средств потребителя. Установленный прибор учёта должен быть опломбирован энергоснабжающей организацией (Правила технической эксплуатации электроустановок потребителей, утвержденных приказом Минэнерго России от 13.01.2003 № 6).Ознакомиться со стоимостью услуг можно на сайте АО «Мосэнергосбыт»."
"За чей счет производится замена, если прибор учёта входит в систему АИИСКУЭ?",Если прибор учёта входит в систему АИИСКУЭ (Автоматизированная информационно измерительная система коммерческого учета электроэнергии) и находится на балансе АО Мосэнергосбыт» замена осуществляется на безвозмездной основе.Оформить заявку на замену прибора учёта Вы можете:Через оператора Контактного центра по телефону +7 (499) 550-9-550 (ежедневно с 08:30 до 20:30);В любом отделении АО «Мосэнергосбыт».
"За чей счет производится замена, если прибор учёта был установлен на платной основе сотрудником АО «Мосэнергосбыт»?",В случаевыхода прибора учета из строя или истечения срока межповерочного интервала замена прибора учета осуществляется гарантирующим поставщиком. Оформить заявку на замену прибора учёта Вы можете: Через оператора Контактного центра по телефону +7 (499) 550-9-550 (ежедневно с 08:30 до 20:30);
Когда заменят неисправный электросчётчик?,"Согласно изменениям в Постановление Правительства №354 замена прибора учёта гарантирующим поставщиком и сетевой организацией должна быть выполнена в следующие сроки:Если по состоянию на 01.04.2020 или ранее у потребителя отсутствовал ПУ/истек срок его эксплуатации/вышел из строя, то установка (замена) ПУ осуществляется до 31.12.2023.В иных случаях – установка (замена) должна быть осуществлена в течение 6 месяцев.Если по состоянию на 01.04.2020 или ранее у потребителя истек МПИ ПУ, то установка (замена) со стороны ГП осуществляется до 31.12.2021.График замены приборов учета в многоквартирных жилых домах Москвы и Московской области можно посмотреть на сайте АО «Мосэнергосбыт».Оформить бесплатную заявку на замену прибора учета можно:жителям многоквартирных домов по телефону АО «Мосэнергосбыт» +7 (499) 550-9-550 (ежедневно с 8:30 до 20:30) или в Едином личной кабинете;жителям частного сектора – по телефону сетевой компании ПАО «Россети Московский регион» 8-800-220-0-220."
В какой срок выполняется заявка?,"В соответствии с требованиями Федерального закона от 27.12.2018 № 522-ФЗ «О внесении изменений в отдельные законодательные акты Российской Федерации в связи с развитием систем учёта электрической энергии (мощности) в Российской Федерации» и постановления Правительстваот 29.06.2020 № 950 «О внесении изменений в некоторые акты Правительства Российской Федерации по вопросам совершенствования организации учёта электрической энергии» с 1 июля 2020 года обязанность по замене неисправных приборов учёта электроэнергии или счётчиков электроэнергии с истекшим межповерочным интервалом, в жилых помещениях многоквартирных жилых домов возложена на гарантирующего поставщика электроэнергии. В Москве и Московской области гарантирующим поставщиком электроэнергии является АО «Мосэнергосбыт». В индивидуальных жилых домах эта обязанность возложена на сетевые организации ПАО «Россети Московский регион». Замена приборов учёта будет осуществляться в следующие сроки:Если по состоянию на 01.04.2020 или ранее у потребителя отсутствовал ПУ/истёк срок его эксплуатации/вышел из строя, то установка (замена) ПУ осуществляется до 31.12.2023.Если по состоянию на 01.04.2020 или ранее у потребителя истёк МПИ ПУ, то установка (замена) со стороны ГП осуществляется до 31.12.2021.В иных случаях – установка (замена) должна быть осуществлена в течение 6 месяцев.График замены приборов учёта в многоквартирных жилых домах Москвы и Московской области можно посмотреть на сайте АО «Мосэнергосбыт».В остальных случаях замена/установка прибора учёта осуществляется на платной основе. Заявка выполняется в срок, не превышающий 10 рабочих дней с момента поступления оплаты на расчётный счёт АО «Мосэнергосбыт». После поступления оплаты с клиентом связывается мастер (сотрудник АО «Мосэнергосбыт») для уточнения времени проведения работ."
Как будут осуществляться начисления с даты поломки (выхода за МПИ) до даты замены электросчётчика?,Начисления за электроэнергию в случае выхода прибора учёта из строя или за межповерочный интервал в соответствии с внесенными изменениями в законодательство будут осуществляться исходя из среднемесячного объема потребления в предыдущие периоды (на основании статистической информации по потреблению в предыдущие месяцы) или исходя из норматива потребления в случае отсутствия возможности осуществить расчет среднемесячного объёма потребления электроэнергии.
Что такое МПИ?,"Как и любой прибор, электросчётчик имеет свой ресурс бесперебойной работы. Он называется межповерочный интервал (или МПИ) – это срок, в течение которого завод-изготовитель гарантирует, что показания прибора будут точны и не будут превышать предел допустимой погрешности приборов учёта. По истечении МПИ прибор начинает неверно учитывать расход электроэнергии. При истечении сроков МПИ необходима его замена или поверка."
Как узнать срок МПИ?,"Межповерочный интервал указан в паспорте на прибор учёта. Сроки МПИ для приборов учёта разные и варьируются  от 6 до 16 лет, зависят от модели и типа прибора учета. Ознакомиться с информацией о сроке окончания МПИ, установленного по Вашему адресу, можно в Личном кабинете клиента в разделе «Реквизиты ЛС»."
