Question,Answer
"Закончился срок МПИ, возможно ли осуществить поверку прибора учета?","В связи с тем, что по истечении срока МПИ точность показаний гарантироваться не может, поскольку со временем детали электросчётчика изнашиваются, расход электроэнергии по показаниям может отличаться от фактического как в большую, так и в меньшую сторону.Можно осуществить поверку прибора учёта, которая проводится в специализированной лаборатории. Поверка является длительным и сложным технологическим процессом, а по результатам поверки может оказаться, что прибор учёта все равно нужно менять.Внимание! Приборы учёта, у которых истек межповерочный интервал и имеют класс точности ниже 2,0 – не могут использоваться при расчетах (п.139 основных положений функционирования розничных рынков электрической энергии утв. Постановлением Правительства РФ от 4 мая 2012 г. № 442).При желании осуществить поверку самостоятельно (силами специализированной лаборатории) необходимо заранее сообщить в по телефону Контактного центра + 7(499) 550-9-550 или в обслуживающее отделение АО «Мосэнергосбыт».В связи с изменениями в Постановлении Правительства №354 с 1 июля 2020 года обязанность по замене неисправных приборов учета электроэнергии или счетчиков электроэнергии с истекшим межповерочным интервалом, в жилых помещениях многоквартирных жилых домов возложена на гарантирующего поставщика электроэнергии. В Москве и Московской области гарантирующим поставщиком электроэнергии является АО «Мосэнергосбыт». В индивидуальных жилых домах эта обязанность возложена на сетевые организации ПАО «Россети Московский регион». "
Как оплатить услугу по установке/замене прибора учета?,"Оплатить услуги можно любым удобным способом:Банковской картой на сайте АО «Мосэнергосбыт» / «Способы оплаты дополнительных услуг»;Через платежные терминалы, установленные в любом отделении АО «Мосэнергосбыт»;В любом банке."
Возможно ли произвести оплату наличными мастеру?,"Оплата наличными денежными средствами предусмотрена только для жителей г. Москвы. В этом случае оплата будет производиться наличными мастеру перед выполнением услуги. Сотрудник предоставит чек контрольно - кассового аппарата, после чего приступит к выполнению услуги."
Какие документы предоставляются после оказания услуги?,"После оказания услуги мастер предоставляет паспорт прибора (если услуга с учетом стоимости электросчётчика) и договор (по требованию клиента). Ознакомиться с договором оказания услуг по замене прибора учёта электрической энергии можно на сайте АО «Мосэнергосбыт», а при необходимости его получения следует сообщить заранее, во время оформления услуги. Акт приёма электросчетчика в эксплуатацию направляется в электронном виде на электронную почту абонента или предоставляется на бумажном носителе в любом отделении АО «Мосэнергосбыт»."
Что такое гарантийное обслуживание прибора учета?,"Услуга заключается в предоставлении гарантийных обязательств, включающих в себя замену либо ремонт вышедшего из строя прибора учета электроэнергии, сроком на 2, 4 и 7 летпосле истечения гарантийного срока, установленного заводом-производителем (3 года).Итого гарантийный срок составит 5, 7 и 10 лет (в зависимости от выбранной услуги)."
Как оформить гарантийное обслуживание?,"Данная услуга доступна только при оформлении заявки на установку нового прибора учёта.Оформить «Гарантийное обслуживание прибора учета электроэнергии» можно любым удобным способом:Позвонив Контактный центр по телефону +7 (499) 550-33-77;В любом отделении АО «Мосэнергосбыт».Срок дополнительной гарантии начинается со дня, следующего за днем окончания гарантии завода-изготовителя."
Преимущества гарантийного обслуживания,"Приобретая гарантийное обслуживание, Вы получаете:Экономию денежных средств - гарантийное обслуживание прибора учёта электроэнергии на 2, 4 или 7 лет, которое позволит не волноваться о дополнительных затратах, так как специалисты АО «Мосэнергосбыт» в случае выхода прибора учёта  из строя бесплатно и в кратчайшие сроки произведут его замену;Замену прибора учёта электроэнергии по гарантии неограниченное количество раз в течение всего срока действия договора.Экономию времени на выяснение причин неисправности прибора учёта;Ознакомиться со стоимостью и договором на оказание данной услуги  можно на сайте АО «Мосэнергосбыт»."
Как оформить гарантийное обслуживание?,"Данная услуга доступна только при оформлении заявки на установку нового прибора учёта.Оформить «Гарантийное обслуживание прибора учета электроэнергии» можно любым удобным способом:Позвонив Контактный центр по телефону +7 (499) 550-33-77 (ежедневно с 8:30 до 20:30);В любом отделении АО «Мосэнергосбыт».Срок дополнительной гарантии начинается со дня, следующего за днем окончания гарантии завода-изготовителя."
Коммерческие услуги АО «Мосэнергосбыт»,"АО «Мосэнергосбыт» предлагает широкий спектр коммерческих услуг, с которым можно ознакомиться на сайте."
Как оформить коммерческую услугу?,"Для того чтобы оформить услугу, достаточно воспользоваться одним из способов:Оформить заявку на популярные услуги в Личном кабинете клиента;Позвонить в Контактный центр по телефону +7 (499) 550-33-77 (ежедневно с 8:30 до 20:30);В любом отделении АО «Мосэнергосбыт»."
Как оплатить услугу по установке/замене прибора учёта?,"Оплатить услуги можно любым удобным способом:Банковской картой на сайте АО «Мосэнергосбыт» - «Способы оплаты дополнительных услуг»;Через платежные терминалы, установленные в любом отделении АО «Мосэнергосбыт»;В любом банке;"
Какие документы предоставляются после оказания услуги?,"После оказания услуги мастер предоставляет паспорт прибора (если услуга с учетом стоимости электросчётчика) и договор (по требованию клиента). Ознакомиться с договором оказания услуг по замене прибора учёта электрической энергии можно на сайте АО «Мосэнергосбыт», а при необходимости его получения следует сообщить заранее, во время оформления услуги. Акт приёма электросчетчика в эксплуатацию направляется в электронном виде на электронную почту абонента или предоставляется на бумажном носителе в любом отделении АО «Мосэнергосбыт»."
Не передаются показания через Личный кабинет клиента?,"Функция по передаче показаний активна в период с 15-го по 26-е число каждого месяца. Показания невозможнопередать, если прибор учёта  подключен к автоматической системе учёта электроэнергии  или прибор учётанеисправен."
Как подключить дополнительный Лицевой счёт?,"Для подключения двух и более лицевых счётов к одной учётной записи необходимо использовать функцию «Добавить лицевой счёт» в левом боковом меню. В появившемся окне указать поставщика и ввести лицевой счёт, после чего нажать кнопку «Подключить». В открывшемся окне «Ответьте на контрольный вопрос» необходимо выбрать вопрос в поле «Контрольный вопрос», в поле «Ответ» указать верную информацию по вопросу, далее нажать кнопку «Подтвердить». Например, при контрольном вопросе «Введите сумму «Итого по счёту» или «Итого переплата», указанную в любой из квитанций за последние 6 месяцев, отделив копейки запятой.» необходимо в поле «Ответ» внести корректную информацию, после чего нажать на кнопку ""Подключить"".Если введенные данные были указаны верно, появится окно с уведомлением о том, что лицевой счёт успешно подключен"
Как отключить дополнительный Лицевой счёт?,"Для того чтобы отключить дополнительный Лицевой счет необходимо нажать на три точки, расположенные в левой части бокового меню рядом с номером лицевого счета, далее нажать «Удалить»."
Как можно подключить услугу «Автоплатёж»?,"Для подключения данной услуги необходимо на главной странице под информационным блоком «Автоплатеж» нажать кнопку «Подключить», ознакомиться с условиями предоставления данной услуги и заполнить заявление на Автоплатеж."
Как отключить «Автоматический платеж»?,Для отключения данной услуги необходимо на главной странице нажать на «Отключить»/«Аннулировать».
Как подписаться на электронную рассылку квитанций?," Для настройки получения электронной квитанции необходимо в разделе «Профиль» в блоке «Получение счёта по e-mail» указать интересующий способ получения квитанции по лицевому счёту. После подписки на электронную рассылку счётов, квитанции на бумажном носителе направляться не будут."
Где в Личном кабинете клиента можно посмотреть произведенные платежи?,"Посмотреть информацию о поступивших платежах можно в карточке лицевого счёта, в разделе «История», выбрав подраздел «Оплаты». В данном подразделе представлена информация по поступивших оплатах – дата, статус, сумма платежа. Для просмотра информации необходимо выбрать интересующий период."
Где в Личном кабинете клиента посмотреть историю показаний?," Показания можно посмотреть в Едином личном кабинете во вкладке «История» - «Показания». Если необходимо посмотреть информацию за более длительный срок, необходимо изменить период."
Как изменить личные данные в Личном кабинете клиента?," Для того чтобы изменить личные данные необходимо в правом верхнем углу выбрать вкладку «Профиль». Самостоятельно в Личном кабинете клиента можно изменить только ФИО пользователя, адрес электронный почты, мобильный номер телефона и пароль для входа в Личный кабинет клиента, подписаться/отписаться на получение платежного документа по электронной почте и на рекламно-информационную рассылкуВ личном кабинете клиента можно оформить заявку на смену собственника, изменение количества проживающих, количества комнат, площади с прикреплением необходимых документов во вкладке «Реквизиты ЛС»/Общая информация/ изменить, далее в открывшемся списке выбрать услугу нужную услугу. Подробная информация здесь."
Что такое статистика потребления?,В графике видна динамика изменения расхода электроэнергии за текущий год на основании фактического потребления.Для просмотра статистики потребления за предыдущий год необходимо изменить период и нажать «Показать».
Что такое текущий баланс?,"Текущий баланс счёта - это актуальный расчёт задолженности или переплаты за электроэнергию на текущий момент, сучётом поступивших платежей и переданных показаний прибора учёта после последнего выставленного счёта."
 Порядок проверки приборов учёта и оформления актов неучтенного потребления , Памятка
Как работать в Едином личном кабинете клиента (ЕЛК ЖКХ)?,"Для удобства работы с Единым ЛКК Вы можете использовать подробную пошаговую инструкцию по работе сервиса, перейдя по ссылке."
В каких браузерах необходимо осуществлять работу в Едином личном кабинете клиента (ЕЛК ЖКХ)?,"Для корректной работы в Едином личном кабинете клиента (ЕЛК ЖКХ) рекомендуется использовать один из перечисленных браузеров: Internet Explorer версии 11.0, Mozilla Firefox версии 58.0 и выше, Opera версии 51.0 и выше, Google Chrome версии 65.0 и выше, Apple Safari версии 11.0 и выше. Не гарантируется стабильная и правильная работа системы при использовании браузеров других версий. Для работы на мобильных устройствах и планшетах для скачивания доступно приложение «Мой Мосэнергосбыт» (для устройств с системой iOS и Android)."
Можно ли с мобильного устройства или планшета работать в Едином личном кабинете клиента (ЕЛК ЖКХ)?,Для работы на мобильных устройствах и планшетах для скачивания доступно приложение «Мой Мосэнергосбыт» (для устройств с системой iOS и Android).
Как зарегистрировать электронный адрес?,"Для регистрации электронного адреса ознакомьтесь со следующим файлом: Создание почтового ящика на ""Yandex"" или ""Mail.ru"". "
Отсутствие электроэнергии при наличии задолженности по Лицевому счету,При наличии задолженности по Лицевому счету не менее суммы двух месячных начислений за два последних периода АО «Мосэнергосбыт» имеет право приостановить подачу энергоснабжения.
Как восстановить подачу электроэнергии?,"Восстановление подачи электроэнергии осуществляется на платной основе и при полной оплате задолженности на момент отключения. Для восстановления  подачи электроэнергии необходимо:обратиться в обслуживающее отделение АО «Мосэнергосбыт» иливоспользоваться терминалом видеосвязи (Автоматизированная система «Видеоконсультант») с оператором Контактного центра, установленным в МФЦ. Часы работы: Пн-Пт с 08:30 до 20:00.Внимание! При обращении в отделение АО «Мосэнергосбыт» или через терминал видеосвязи (установленный в МФЦ) необходимо предоставить квитанцию об оплате задолженности."
Оповещения по аварийным и плановым отключениям,"Подписаться на бесплатные смс и/или e-mail уведомления по аварийным и плановым отключениям, ограничениям энергоснабжения можно здесь"
От чего зависит качество электрической энергии?,"Причинами ухудшения качества электроэнергии могут являться:  - короткие замыкания в распределительной сети;аварии в электрической сети;неравномерность распределения нагрузки у потребителя по отдельным фазам;срабатывание средств защиты и автоматики;электромагнитные и сетевые возмущения (переходные процессы), связанные с включением, отключением и работой мощных потребителей электроэнергии и др.износ электрооборудования."
Почему случаются перепады напряжения?,"Изменения характеристик напряжения, связаны с такими явлениями, как например, провалы и прерывания напряжения, перенапряжения и импульсные напряжения. Провалы напряжения обычно происходят из-за неисправностей в электрических сетях или в электроустановках потребителей, а также при подключении мощной нагрузки.Перенапряжения, как правило, вызываются переключениями и отключениями нагрузки. Импульсные напряжения вызываются в основном молниевыми разрядами или процессами коммутации в электрической сети или электроустановке потребителя."
