Question,Answer
Как изменить ФИО собственника?,"Для переоформления лицевого счета на нового владельца, собственнику необходимо обратиться в любое отделение АО«Мосэнергосбыт».При себе необходимо иметь следующие документы:Договор купли-продажи;Свидетельство о государственной регистрации права собственности (есликвартира в собственности);Копия финансового лицевого счета из жилищной организации (если квартира муниципальная);Паспорт;Текущие показания прибора учета на день обращения в отделение АО «Мосэнергосбыт».Все документы должны быть представлены в оригинале или копии, заверенные нотариусом.Также оформить заявку на изменения данных с прикреплением необходимых документов можно в Едином личном кабинете физического лица во вкладке «Реквизиты ЛС»/Общая информация/ Изменить, далее в открывшемся списке выбрать «Собственника/нанимателя» при условии, что задолженность предыдущего собственника или нерешенные вопросы по оплате долга предыдущего собственника, отсутствуют. "
Как исправить ошибку (или опечатку) в ФИОсобственника?,"Подать заявку на изменение данных можно в личном кабинете клиента физического лица во вкладке «Реквизиты ЛС»/ Общая информация/ Изменить, далее в открывшемся списке выбрать «ФИО собственника/нанимателя» и приложить подтверждающие документы или, обратившись в Контактный центр по телефону +7 (499) 550-9-550. Часы работы: ежедневно с 08:30 до 20:30. "
Как изменить телефон?,"Изменить номер мобильного телефона можно самостоятельно, для этого необходимо в Личном кабинете клиента перейти в раздел ""Профиль"" и внестиизменения.Для изменения номера стационарного (домашнего) телефона, необходимо обратиться в Контактный центр по телефону:+7 (499) 550-9-550 (ежедневно с 08:30 до 20:30)."
Как изменить количество проживающих?,"Изменить данные о количестве проживающих можно только на основании соответствующего документа, в котором указанасоответствующая информация (например, в копии финансово-лицевого счета, выписке из домовой книги или ЕдиномЖилищном Документе).Представить документ можно любым удобным способом:Подать обращение в Личном кабинете клиента с прикреплением необходимых документов необходимо во вкладке «Реквизиты ЛС»/Общая информация/ Изменить, далее в открывшемся списке выбрать «Количество проживающих»;Направить документ на электронный адрес info@mosenergosbyt.ru;Обратиться в любое отделение АО «Мосэнергосбыт».В обращении необходимо указать свои контактные данные: номер лицевого счета, адрес, контактные телефоны, а такжеинформацию, которую необходимо изменить."
Как изменить количество комнат?,"Изменить данные о количестве комнат можно только на основании соответствующего документа, в котором указанасоответствующая информация (например, в копии финансово-лицевого счета, выписке из домовой книги или ЕдиномЖилищном Документе).Представить документ можно любым удобным способом:Подать обращение в Личном кабинете клиента с прикреплением необходимых документов необходимо во вкладке «Реквизиты ЛС»/Общая информация/ Изменить, далее в открывшемся списке выбрать «Количество комнат»;Направить документ на электронный адрес info@mosenergosbyt.ru;Обратиться в любое отделение АО «Мосэнергосбыт».В обращении необходимо указать свои контактные данные: номер лицевого счета, адрес, контактные телефоны, а такжеинформацию, которую необходимо изменить."
Как изменить площадь квартиры?,"Изменить данные о площади квартиры можно только на основании соответствующего документа, в котором указанасоответствующая информация (например, в копии финансово-лицевого счета, выписке из домовой книги или ЕдиномЖилищном Документе).Представить документ можно любым удобным способом:Подать обращение в Личном кабинете клиента с прикреплением необходимых документов необходимо во вкладке «Реквизиты ЛС»/Общая информация/ Изменить, далее в открывшемся списке выбрать «Общую площадь»;Направить документ на электронный адрес info@mosenergosbyt.ru;Обратиться в любое отделение АО «Мосэнергосбыт».В обращении необходимо указать свои контактные данные: номер лицевого счета, адрес, контактные телефоны, а такжеинформацию, которую необходимо изменить."
Как изменить адрес для рассылки счетов?,"Изменить адрес для рассылки ежемесячных счетов, можно одним из удобных для вас способов:Самостоятельно в Личном кабинетеклиента. Для этого необходимо в разделе «Профиль», в блоке «Адрес для квитанций» нажать на редактирование данных. На открывшейся странице «Редактирование адреса для получения квитанции» необходимо заполнить обязательную информацию (населенный пункт, улица, дом, индекс, квартира) и нажать кнопку «Сохранить».Воспользоваться терминалом видеосвязи (Автоматизированная система «Видеоконсультант») с операторомКонтактного центра, установленным в МФЦ. Часы работы: Пн-Пт с 09:00 до 20:00.Обратиться в любое отделение АО«Мосэнергосбыт».Обратиться по номеру телефона Контактного Центра 8-499-550- 95-50 ежедневно с 08:30 до 20:30При указании альтернативного адреса направления документов – по адресу лицевого счета документы направляться небудут."
Как изменить тариф в сельской местности?,"В соответствии с Распоряжением Комитета по ценам и тарифам Московской области для населения, потребляющегоэлектрическую энергию в жилых домах расположенных в сельской местности применяется тариф на электрическуюэнергию с понижающим коэффициентом.Для применения тарифа с понижающим коэффициентом необходимо представить документы в обслуживающее отделение АО«Мосэнергосбыт», подтверждающие, что объект энергоснабжения, в отношении которого должен применяться тариф спонижающим коэффициентом 0,7, является жилым домом (жилым строением) и находиться в сельской местности.Документами, подтверждающие указанные обстоятельства, могут являться:Свидетельство о регистрации права на строение (жилой дом, жилое строение), в котором в графе «объект права»указывается назначение объекта недвижимости «жилое», а также указывается адрес его местонахождения;Или Паспорт гражданина РФ, где может быть указано, что гражданин зарегистрирован по месту нахождения объектаэнергоснабжения."
Порядок проверки приборов учёта и оформления актов неучтенного потребления,Памятка
Как оформить/ продлить/переоформить льготу в Москве?,"Для того чтобы использовать льготу при оплате за электроэнергию, ее необходимо оформить/продлить/переоформить вАО «Мосэнергосбыт» одним из удобных способов:В Едином личном кабинете клиента вовкладке «Льготы» (с прикреплением необходимых документов);Воспользоваться терминалом видеосвязи (Автоматизированная система «Видеоконсультант») с операторомКонтактного центра, установленным в МФЦ. Часы работы: Пн-Пт с 08:30 до 20:00.В любом отделении АО «Мосэнергосбыт».В качестве заявителей могут выступать физические лица, проживающие в городе Москве и обладающие правом на льготы по оплате за электроэнергию в соответствии с нормативными правовыми актами Российской Федерации или города Москвы, и обратившиеся с заявлением. Интересы заявителей, могут представлять законные представители заявителей или иные лица, уполномоченные заявителем в установленном порядке.В соответствии с законодательством РФ льготы по оплате электроэнергии предоставляются гражданам не более чем на одну квартиру (жилое помещение)."
Отказ в приеме документов,"Основаниями для отказа в приеме документов, необходимых для оформления льготы, являются:Представление заявления и иных документов, необходимых для предоставления льготы, не соответствующих требованиям, установленным правовыми актами Российской Федерации, правовыми актами города МосквыПредставление документов, утративших силу, в случаях, когда срок действия установлен в таких документах или предусмотрен законодательством Российской Федерации, правовыми актами города МосквыПредставление неполного комплекта документов, указанных, в качестве документов, подлежащих обязательному представлению заявителемПредставление заявителем документов, содержащих недостоверные и (или) противоречивые сведенияПри отсутствии необходимых сведений для оформления льготы в информационной системе Общегородского регистра получателей мер социальной поддержки (применимо только к льготе по категории многодетная семья)"
Какие документы необходимы для оформления/продления/переоформления льготы?,"Для оформления льготы необходимо представить следующие документы:Документ удостоверяющий личность заявителя (Паспорт);Пенсионное удостоверение (для отдельных категорий граждан);Документы, подтверждающие право заявителя и (или) членов его семьи на льготу по оплате за электроэнергию (Паспорт, свидетельство о рождении, справку МСЭ, удостоверение «Ветеран труда», справку, выдаваемую органами опеки и попечительства или руководителем воспитательного учреждения и т.д.);Страховой номер индивидуального лицевого счета (СНИЛС);Единый Жилищный Документ;Текущие показания счетчика (на день обращения)Документ, удостоверяющий личность представителя заявителя;Документ, подтверждающий полномочия представителя заявителя, в случае обращения представителя заявителя (при обращении лица, уполномоченного заявителем в установленном порядке, - доверенность в простой письменной форме либо нотариально удостоверенная доверенность или доверенность, приравненная к нотариально удостоверенной в соответствии с гражданским законодательством Российской Федерации)Все документы должны быть представлены в оригинале или копии.Обращаем Ваше внимание, что для получения льготы по категории многодетная семья предоставление выше указанных документов не требуется. Льгота оформляется на основании документа, удостоверяющего личность заявителя и СНИЛС. Право на получение льготы в данном случае подтверждается на основании запроса сотрудника АО «Мосэнергосбыт», направляемого к информационной системе Общегородского регистра получателей мер социальной поддержки.Ознакомиться с перечнем льготных категорий можно в Постановлении:Правительства Москвы от 07.12.2004г. № 850-ПП «О порядке и условиях обеспечения мер социальной поддержки граждан по оплате жилья и коммунальных услуг» в редакции действующей на дату обращенияКак рассчитываются льготы можно посмотреть здесь."
Как закрыть льготу?,"Порядок закрытия льготы определяется в зависимости от причины ее закрытия:При переезде льготника льгота закрывается по сообщению льготника или его законного представителя.В случае оформления льготы по новому адресу (при предоставлении всех документов), по прежнему месту жительства льгота закрывается по сообщению льготника или его законного представителя.В случае смерти льготника, родственникам необходимо предоставить свидетельство о смерти.Сделать это можно одним из удобных способов:Самостоятельно в Едином личном кабинете клиента во вкладке «Льготы»;Воспользоваться терминалом видеосвязи (Автоматизированная система «Видеоконсультант») с оператором Контактного центра, установленным в МФЦ. Часы работы: Пн-Пт с 08:30 до 20:00.Обратиться в Контактный центр по телефону +7 (499) 550-9-550 (ежедневно с 08:30 до 20:30).Внимание! При обращении необходимо предоставить показания прибора учета на день обращения. В случае обращения по причине смерти льготника родственникам или законному представителю необходимо предоставить следующие данные: ФИО, дату смерти, номер свидетельства о смерти, кем и где выдано свидетельство о смерти, а также показания прибора учета на момент обращения."
Как оформить льготу в Московской области?,"В соответствии с законом Московской области от 23 марта 2006 г. № 36/2006-ОЗ «О социальной поддержке отдельных категорий граждан в Московской области», принятым постановлением Московской областной Думы от 15 марта 2006 г. № 5/171-П, регистрация льгот в Московской области не производится, оплата за потребленную электроэнергию производится в полном объеме согласно действующим тарифам. По вопросу возмещения льгот необходимо обращаться в отделение социальной защиты Вашего муниципального района."
Льгота 50% от расхода,"Льгота, предусматривающая скидку 50% от расхода электроэнергии, распространяется на весь расход электроэнергии в квартире, вне зависимости от количества проживающих совместно с льготником. Данный вид льготы не суммируется с другими льготами."
Льгота 50% (30%) от норматива,"В соответствии с Постановлением Правительства г. Москвы от 20 декабря 1994 г. № 1161 для граждан, имеющих право на пользование льготой в пределах норматива потребления, установлены следующие нормативные величины:Одинокие граждане, проживающие в квартире, оборудованной:Газовой плитой - 50 кВт·чЭлектрической плитой - 80 кВт·чСемейные граждане, проживающие в квартире, оборудованной:Газовой плитой - 45 кВт·чЭлектрической плитой - 70 кВт·чНорматив установлен на месяц.Если объем электроэнергии, потребленный в расчетном периоде, больше льготного норматива, то скидка в 50% предоставляется на объем в пределах норматива потребления, а оставшиеся часть оплачивается в размере 100% от тарифа.Если в первой части календарного месяца абонент не в полном объеме использовал полагающийся ему льготный норматив, то остаток будет предоставлен во второй части данного календарного месяца, т.е. в счете за следующий расчетный период. Если величина льготного норматива в первой части календарного месяца использована в полном объеме, то на оставшуюся часть расхода данного календарного месяца, относящуюся к следующему расчетному периоду, нормативная льгота не начисляется.При наличии на счете 2-х и более нормативных льгот, при расчете норматив суммируется."
Льгота 100 % от расхода,"Граждане, которым предусмотрена скидка в размере 100% от расхода по оплате электроэнергии, освобождаются от оплаты за потребленную электроэнергию. Льгота может распространяться как на одного льготника (от оплаты за электроэнергию освобождается только та часть расхода, которая приходится на льготника), так и на льготника с учетом членов его семьи. С перечнем льготных категорий граждан, которым полагается данная льгота можно ознакомиться в Постановлении Правительства Москвы от 07.12.2004г. № 850-ПП «О порядке и условиях обеспечения мер социальной поддержки граждан по оплате жилья и коммунальных услуг»."
Расчет льготы от расхода электроэнергии - однотарифный прибор учета,"Условие:Льгота 50% от расхода электроэнергии;ПУ однотарифный;Расчет:Расход ЭЭ× тариф = сумма к оплате×0,5(льготный коэффициент) = сумма к оплате (с учетом льготы)"
